item,itemLabel,position,positionLabel,start,psid
Q106631627,Charlemagne Ouédraogo,Q112030491,Health minister of Burkino Faso,2021-01-10,Q106631627-221ccd27-4a23-41e4-dfc2-8d51575dab2c
Q111184239,Olivia Ragnaghnewendé Rouamba,Q18204360,Minister of Foreign Affairs of Burkina Faso,2022-03-05,Q111184239-67e4a92d-4109-9f13-3d2e-5e39ad97a713
Q113623274,Aminata Zerbo-Sabané,Q113623389,"Minister of Digital Transition, Posts and Electronic Communications of Burkina Faso",2022-03-05,Q113623274-38bd49f2-4e92-94ab-ff0a-842f4887a01f
Q114341246,Ibrahim Traore,Q20995488,President of Burkina Faso,2022-09-30,Q114341246-2a8ab14a-44e3-3270-6eaf-31b2c449e55c
Q12897461,Stanislas Ouaro,Q112709348,Education minister of Burkina Faso,2019-01-24,Q12897461-49A9ED2A-EDD2-49DD-9EFD-D7F48F17E0F1
Q98846914,Lassané Kaboré,Q98846005,Minister of Finance of Burkina Faso,2019-01-24,Q98846914-b005633c-4eaa-c1c4-261f-d57b839ee879
